<?xml version="1.0" encoding="UTF-8"?>
<!DOCTYPE tmc-service-pub SYSTEM "../dtd/pub.dtd">
<tmc-service-pub><dtd-version version="1.0"/><pub id="EM25T0E" type="EM" xml:lang="en"><name>LAND CRUISER Electrical Wiring Diagram</name><models><model><model-name>LAND CRUISER</model-name><model-code code="GRJ71L"><engine-code>1GR-FE</engine-code></model-code><model-code code="GRJ76L"><engine-code>1GR-FE</engine-code></model-code><model-code code="GRJ78L"><engine-code>1GR-FE</engine-code></model-code><model-code code="GRJ79L"><engine-code>1GR-FE</engine-code></model-code><model-code code="GRJ79R"><engine-code>1GR-FE</engine-code></model-code><model-code code="HZJ71L"><engine-code>1HZ</engine-code></model-code><model-code code="HZJ71R"><engine-code>1HZ</engine-code></model-code><model-code code="HZJ76L"><engine-code>1HZ</engine-code></model-code><model-code code="HZJ76R"><engine-code>1HZ</engine-code></model-code><model-code code="HZJ78L"><engine-code>1HZ</engine-code></model-code><model-code code="HZJ78R"><engine-code>1HZ</engine-code></model-code><model-code code="HZJ79L"><engine-code>1HZ</engine-code></model-code><model-code code="HZJ79R"><engine-code>1HZ</engine-code></model-code><model-code code="VDJ76L"><engine-code>1VD-FTV</engine-code></model-code><model-code code="VDJ76R"><engine-code>1VD-FTV</engine-code></model-code><model-code code="VDJ78L"><engine-code>1VD-FTV</engine-code></model-code><model-code code="VDJ78R"><engine-code>1VD-FTV</engine-code></model-code><model-code code="VDJ79L"><engine-code>1VD-FTV</engine-code></model-code><model-code code="VDJ79R"><engine-code>1VD-FTV</engine-code></model-code></model></models><brand>TOYOTA</brand><market-code>E</market-code><plants><plant>TMC</plant></plants><entry-date>20140612</entry-date><publish-date>20161221</publish-date><fin-date>20161222</fin-date><term-base><term alt-pub-id="EM25T0E" date="201408" term-id-from="001">Improvement</term><term alt-pub-id="EM25T1E" date="201608" term-id-from="002">Improvement</term><term alt-pub-id="EM25T2E" date="201701" term-id-from="003">Improvement</term></term-base><revision><release send-date="20140714"><term alt-pub-id="EM25T0E" date="201408" term-id-from="001">Improvement</term></release><release send-date="20160805"><term alt-pub-id="EM25T1E" date="201608" term-id-from="002">Improvement</term></release><release send-date="20161221"><term alt-pub-id="EM25T2E" date="201701" term-id-from="003">Improvement</term></release></revision></pub></tmc-service-pub>